1,RoyalCanin IndoorAdult,Croquetas para gato adulto control de bolas de pelo RoyalCanin,18.50,royalcanin_indooradult.jpg
2,RoyalCanin KittenDry,Alimento seco nutricion balanceada para gatitos RoyalCanin,16.90,royalcanin_kittendry.jpg
3,Whiskas TunaBites,Snacks sabor atun para gato Whiskas,4.20,whiskas_tunabites.jpg
4,Whiskas ChickenCrunch,Premio crujiente sabor pollo Whiskas,3.90,whiskas_chickencrunch.jpg
5,Friskies OceanMix,Alimento seco mezcla pescado para gatos Friskies,12.80,friskies_oceanmix.jpg
6,Friskies CatParty,Snacks variados para gatos Friskies,5.10,friskies_catparty.jpg
7,Catit SensesBall,Juguete pelota interactiva para gato Catit,8.70,catit_sensesball.jpg
8,Catit TunnelPlay,Tunel de juego flexible para gato Catit,14.60,catit_tunnelplay.jpg
9,Kong FeatherTeaser,Juguete teaser con pluma para gato Kong,9.40,kong_featherteaser.jpg
10,Kong SoftMouse,Juguete raton suave para gatos Kong,7.10,kong_softmouse.jpg
11,Petstages TowerTracks,Torre de pistas para gatos Petstages,22.90,petstages_towertracks.jpg
12,Petstages ChaseBall,Bola ligera para juego activo Petstages,6.50,petstages_chaseball.jpg
13,Trixie PlushMouse,Raton de peluche para gato Trixie,4.80,trixie_plushmouse.jpg
14,Trixie CatTunnel,Tunel plegable para gato Trixie,13.40,trixie_cattunnel.jpg
15,Hartz CatnipToy,Juguete con catnip integrado Hartz,5.60,hartz_catniptoy.jpg
16,Hartz ChewMouse,Raton resistente con aroma a catnip Hartz,6.20,hartz_chewmouse.jpg
17,Orijen CatTreats,Premios naturales para gato Orijen,9.90,orijen_cattreats.jpg
18,Orijen SixFishDry,Alimento premium de seis pescados para gato Orijen,24.70,orijen_sixfishdry.jpg
19,BlueBuffalo CatTurkey,Alimento de pavo para gato BlueBuffalo,19.30,bluebuffalo_catturkey.jpg
20,BlueBuffalo IndoorMix,Formula interior para gato adulto BlueBuffalo,21.10,bluebuffalo_indoormix.jpg
